{
  "schema_version": "7.0",
  "object_request": {
    "method": "POST",
    "path": "/api/v7/ingest/events",
    "headers": {
      "Authorization": "Bearer deployment-token-redacted",
      "X-Sentry-Delivery-Mode": "remote_v7",
      "X-Sentry-Box-Credential": "box-credential-redacted",
      "X-Sentry-Placement-Generation": 3,
      "X-Sentry-Stream-Sequence": 4
    },
    "object_id": "11111111-1111-4111-8111-111111111111",
    "payload_sha256": "aaaaaaaaaaaaaaaaaaaaaaaaaaaaaaaaaaaaaaaaaaaaaaaaaaaaaaaaaaaaaaaa"
  },
  "accepted_ack": {
    "status": "accepted",
    "sequence": 4,
    "deployment_id": "north-yard",
    "box_id": "bbbbbbbb-bbbb-4bbb-8bbb-bbbbbbbbbbbb",
    "placement_generation": 3,
    "stream_id": "dddddddd-dddd-4ddd-8ddd-dddddddddddd",
    "highest_contiguous_sequence": 6,
    "highest_received_sequence": 6
  },
  "duplicate_ack": {
    "status": "duplicate",
    "sequence": 4,
    "deployment_id": "north-yard",
    "box_id": "bbbbbbbb-bbbb-4bbb-8bbb-bbbbbbbbbbbb",
    "placement_generation": 3,
    "stream_id": "dddddddd-dddd-4ddd-8ddd-dddddddddddd",
    "highest_contiguous_sequence": 6,
    "highest_received_sequence": 6
  },
  "skip_request": {
    "method": "POST",
    "path": "/api/v7/ingest/skip",
    "headers": {
      "Authorization": "Bearer deployment-token-redacted",
      "X-Sentry-Delivery-Mode": "remote_v7",
      "X-Sentry-Box-Credential": "box-credential-redacted",
      "X-Sentry-Placement-Generation": 3
    },
    "body": {"sequence": 7, "reason": "validation_failed"}
  },
  "skip_ack": {
    "status": "accepted",
    "sequence": 7,
    "deployment_id": "north-yard",
    "box_id": "bbbbbbbb-bbbb-4bbb-8bbb-bbbbbbbbbbbb",
    "placement_generation": 3,
    "stream_id": "dddddddd-dddd-4ddd-8ddd-dddddddddddd",
    "highest_contiguous_sequence": 7,
    "highest_received_sequence": 7
  },
  "stream_request": {
    "method": "GET",
    "path": "/api/v7/ingest/stream",
    "headers": {
      "Authorization": "Bearer deployment-token-redacted",
      "X-Sentry-Delivery-Mode": "remote_v7",
      "X-Sentry-Box-Credential": "box-credential-redacted",
      "X-Sentry-Placement-Generation": 3
    }
  },
  "stream_state": {
    "status": "accepted",
    "sequence": 7,
    "deployment_id": "north-yard",
    "box_id": "bbbbbbbb-bbbb-4bbb-8bbb-bbbbbbbbbbbb",
    "placement_generation": 3,
    "stream_id": "dddddddd-dddd-4ddd-8ddd-dddddddddddd",
    "highest_contiguous_sequence": 7,
    "highest_received_sequence": 7
  },
  "gap_progression": {
    "received_before_gap_fill": [1, 2, 3, 5, 6],
    "before": {
      "status": "accepted",
      "sequence": 6,
      "deployment_id": "north-yard",
      "box_id": "bbbbbbbb-bbbb-4bbb-8bbb-bbbbbbbbbbbb",
      "placement_generation": 3,
      "stream_id": "dddddddd-dddd-4ddd-8ddd-dddddddddddd",
      "highest_contiguous_sequence": 3,
      "highest_received_sequence": 6
    },
    "gap_fill": 4,
    "after": {
      "status": "accepted",
      "sequence": 4,
      "deployment_id": "north-yard",
      "box_id": "bbbbbbbb-bbbb-4bbb-8bbb-bbbbbbbbbbbb",
      "placement_generation": 3,
      "stream_id": "dddddddd-dddd-4ddd-8ddd-dddddddddddd",
      "highest_contiguous_sequence": 6,
      "highest_received_sequence": 6
    }
  },
  "offline_eviction": {
    "disconnected": true,
    "sequence": 8,
    "reason": "evidence_expired",
    "local_state": "skip_pending",
    "state_committed_and_fsynced_before_delete": true,
    "payload_bytes_retained": false,
    "after_reconnect_state": "skipped"
  },
  "lost_state_recovery": {
    "highest_contiguous_sequence": 3,
    "highest_received_sequence": 6,
    "next_sequence": 7,
    "skips": [
      {"sequence": 4, "reason": "object_unreadable"},
      {"sequence": 5, "reason": "object_unreadable"},
      {"sequence": 6, "reason": "object_unreadable"}
    ],
    "receipt_conflict_http_status": 409,
    "receipt_conflict_treated_as_success": true
  },
  "parent_child_skip": {
    "cascade_owner": "runtime",
    "one_skip_request_per_object": true,
    "parent": {
      "sequence": 10,
      "object_type": "observation",
      "reason": "validation_failed",
      "local_state": "skip_pending"
    },
    "children": [
      {
        "sequence": 11,
        "object_type": "evidence",
        "reason": "validation_failed",
        "local_state": "skip_pending"
      },
      {
        "sequence": 12,
        "object_type": "embedding",
        "reason": "validation_failed",
        "local_state": "skip_pending"
      }
    ],
    "defensive_child_upload": {
      "http_status": 200,
      "status": "duplicate"
    }
  },
  "dead_letter_policy": {
    "path": "/state/dead-letter",
    "maximum_records": 1000,
    "maximum_age_days": 7,
    "counts_toward_outbox_cap": true,
    "payload_bytes_after_skip": false,
    "metadata_fields": [
      "sequence", "object_type", "object_id", "payload_sha256", "reason",
      "last_error", "attempts", "created_at", "skipped_at"
    ]
  },
  "payload_hashing": {
    "observation": "sha256_exact_application_json_body_bytes",
    "evidence_content_sha256": "sha256_raw_image_bytes",
    "evidence_delivery_payload_sha256": "sha256_sentry_canonical_metadata_json_v1_nul_raw_image_bytes",
    "embedding": "sha256_exact_application_json_body_bytes"
  },
  "two_deployments_one_box": {
    "box_id": "bbbbbbbb-bbbb-4bbb-8bbb-bbbbbbbbbbbb",
    "one_runtime_process_per_deployment": true,
    "one_pvc_per_deployment": true,
    "streams": [
      {
        "deployment_id": "north-yard",
        "placement_generation": 3,
        "first_sequence": 1,
        "highest_contiguous_sequence": 7,
        "highest_received_sequence": 7
      },
      {
        "deployment_id": "south-yard",
        "placement_generation": 1,
        "first_sequence": 1,
        "highest_contiguous_sequence": 1,
        "highest_received_sequence": 3
      }
    ]
  },
  "ack_validation": {
    "deployment_matches": true,
    "box_matches": true,
    "generation_matches": true,
    "contiguous_lte_received": true,
    "sequence_lte_received": true,
    "watermarks_never_decrease": true
  },
  "delivery_modes": {
    "remote": "remote_v7",
    "local": "local_v7"
  },
  "local_object_request": {
    "method": "POST",
    "path": "/api/v7/ingest/events",
    "headers": {
      "Authorization": "Bearer local-deployment-token-redacted",
      "X-Sentry-Delivery-Mode": "local_v7",
      "X-Sentry-Placement-Generation": 1,
      "X-Sentry-Stream-Sequence": 1
    },
    "object_id": "22222222-2222-4222-8222-222222222222",
    "payload_sha256": "bbbbbbbbbbbbbbbbbbbbbbbbbbbbbbbbbbbbbbbbbbbbbbbbbbbbbbbbbbbbbbbb"
  },
  "local_skip_request": {
    "method": "POST",
    "path": "/api/v7/ingest/skip",
    "headers": {
      "Authorization": "Bearer local-deployment-token-redacted",
      "X-Sentry-Delivery-Mode": "local_v7",
      "X-Sentry-Placement-Generation": 1
    },
    "body": {"sequence": 2, "reason": "object_unreadable"}
  },
  "local_stream_request": {
    "method": "GET",
    "path": "/api/v7/ingest/stream",
    "headers": {
      "Authorization": "Bearer local-deployment-token-redacted",
      "X-Sentry-Delivery-Mode": "local_v7",
      "X-Sentry-Placement-Generation": 1
    }
  },
  "stream_bootstrap": {
    "query_before_upload": true,
    "persist_stream_id": true,
    "stream_id_stable_across_placement": true,
    "unexpected_stream_id_action": "pause_uploads_and_deletion_require_recovery"
  },
  "receipt_conflict_resolution": {
    "http_status": 409,
    "store_diagnostic_metadata": true,
    "query_stream": true,
    "local_state": "resolved_by_remote_receipt",
    "send_skip": false,
    "renumber": false
  },
  "storage_profile": {
    "access_mode": "ReadWriteOnce",
    "storage_class": "local-path",
    "volume_mode": "Filesystem",
    "filesystem": "ext4",
    "network_filesystems": "prohibited_unless_separately_qualified",
    "qualification": "power_loss_and_node_reboot_with_wal_recovery"
  }
}
